{
  "schema_version": "0.4.0",
  "id": "22222222-2222-4222-8222-222222222222",
  "project_id": "11111111-1111-4111-8111-111111111111",
  "created_at": "2026-08-18T02:00:00Z",
  "created_by": "主编",
  "title": "青石夜祠",
  "language": "zh-CN",
  "status": "Effective",
  "must_write": [
    "只写林晚在青石镇的七日"
  ],
  "must_not_write": [
    "禁止第二主角视角"
  ],
  "notes": "规格是编辑约束，不是 Canon。"
}
